{
  "catalog_version": "v0",
  "title": "Seed Agent Capability Tree",
  "root": "app/catalog",
  "sections": [
    {
      "id": "dsl",
      "title": "Blueprint DSL",
      "paths": [
        "blueprint_dsl_v0.json"
      ]
    },
    {
      "id": "errors",
      "title": "Error Contracts",
      "paths": [
        "error_envelope_v0.json"
      ]
    },
    {
      "id": "modules",
      "title": "Module Manifests",
      "path_prefix": "modules/"
    },
    {
      "id": "domains",
      "title": "Domain Packs",
      "path_prefix": "domains/"
    },
    {
      "id": "schemas",
      "title": "Catalog Schemas",
      "paths": [
        "tree_schema_v0.json"
      ]
    },
    {
      "id": "policies",
      "title": "Orchestration Policies",
      "paths": [
        "orchestration_policy_v0.json"
      ]
    },
    {
      "id": "patterns",
      "title": "Blueprint Patterns",
      "paths": [
        "blueprint_patterns_v0.json"
      ]
    }
  ],
  "nodes": [
    {
      "id": "dsl:blueprint_v0",
      "title": "Blueprint DSL v0",
      "kind": "dsl",
      "path": "blueprint_dsl_v0.json",
      "tags": [
        "blueprint",
        "dsl",
        "v0"
      ],
      "summary": "Formal authoring contract for saga blueprints."
    },
    {
      "id": "pattern:blueprint_patterns_v0",
      "title": "Blueprint Patterns v0",
      "kind": "pattern",
      "path": "blueprint_patterns_v0.json",
      "tags": [
        "pattern",
        "blueprint",
        "orchestration",
        "v0"
      ],
      "summary": "Reusable blueprint assembly patterns for common orchestration tasks."
    },
    {
      "id": "domain:neoeats:map",
      "title": "NeoEats Domain Map v0",
      "kind": "domain",
      "path": "domains/neoeats/domain_map_v0.json",
      "tags": [
        "domain",
        "neoeats",
        "v0"
      ],
      "summary": "NeoEats entities and orchestration guidance."
    },
    {
      "id": "domain:neoeats:entities",
      "title": "NeoEats Entities v0",
      "kind": "domain",
      "path": "domains/neoeats/entities_v0.json",
      "tags": [
        "domain",
        "neoeats",
        "entities",
        "v0"
      ],
      "summary": "Entity catalog for NeoEats workflows."
    },
    {
      "id": "domain:neoeats:nutrition_table",
      "title": "NeoEats Nutrition Table v0",
      "kind": "domain",
      "path": "domains/neoeats/nutrition_table_v0.json",
      "tags": [
        "domain",
        "neoeats",
        "nutrition",
        "v0"
      ],
      "summary": "Local deterministic nutrition table for facts-first recipe compilation."
    },
    {
      "id": "domain:neoeats:recipe_card_v1",
      "title": "NeoEats Recipe Card Schema v1",
      "kind": "domain",
      "path": "domains/neoeats/recipe_card_v1.json",
      "tags": [
        "domain",
        "neoeats",
        "schema",
        "recipe_card",
        "v1"
      ],
      "summary": "Strict facts-first recipe card contract for UI-safe rendering."
    },
    {
      "id": "domain:neoeats:cooking_plan_v1",
      "title": "NeoEats Cooking Plan Schema v1",
      "kind": "domain",
      "path": "domains/neoeats/cooking_plan_v1.json",
      "tags": [
        "domain",
        "neoeats",
        "schema",
        "cooking_plan",
        "v1"
      ],
      "summary": "Structured Cooking Mode plan contract with steps, timers, and ingredient refs."
    },
    {
      "id": "domain:neoeats:example:recipe_pipeline_v1",
      "title": "NeoEats Recipe Pipeline Example",
      "kind": "example",
      "path": "domains/neoeats/examples/recipe_pipeline_v1.json",
      "tags": [
        "domain",
        "neoeats",
        "example",
        "blueprint"
      ],
      "summary": "Example blueprint for inventory availability + recipe generation."
    },
    {
      "id": "domain:neoeats:example:recipe_pipeline_v2",
      "title": "NeoEats Recipe Pipeline Example v2",
      "kind": "example",
      "path": "domains/neoeats/examples/recipe_pipeline_v2.json",
      "tags": [
        "domain",
        "neoeats",
        "example",
        "blueprint",
        "recipe"
      ],
      "summary": "DRY_RUN/STUB-safe recipe pipeline with normalize, generate, and validate steps."
    },
    {
      "id": "domain:neoeats:example:recipe_pipeline_v3",
      "title": "NeoEats Recipe Pipeline Example v3",
      "kind": "example",
      "path": "domains/neoeats/examples/recipe_pipeline_v3.json",
      "tags": [
        "domain",
        "neoeats",
        "example",
        "blueprint",
        "facts_first"
      ],
      "summary": "Facts-first recipe pipeline with strict compile and nutrition estimation."
    },
    {
      "id": "errors:error_envelope_v0",
      "title": "Error Envelope v0",
      "kind": "schema",
      "path": "error_envelope_v0.json",
      "tags": [
        "errors",
        "api",
        "v0"
      ],
      "summary": "Shared API error response contract."
    },
    {
      "id": "module:accounting_block",
      "title": "Accounting Block",
      "kind": "module",
      "path": "modules/accounting_block.json",
      "tags": [
        "finance",
        "neoeats",
        "saga"
      ],
      "stability": "stable",
      "summary": "Post receipts and update daily financial ledger.",
      "risk_level": "high"
    },
    {
      "id": "module:admin_add_product",
      "title": "Admin Add Product",
      "kind": "module",
      "path": "modules/admin_add_product.json",
      "tags": [
        "admin",
        "neoeats",
        "saga"
      ],
      "stability": "stable",
      "summary": "Add a new product into the inventory catalog.",
      "risk_level": "high"
    },
    {
      "id": "module:admin_remove_product",
      "title": "Admin Remove Product",
      "kind": "module",
      "path": "modules/admin_remove_product.json",
      "tags": [
        "admin",
        "neoeats",
        "saga"
      ],
      "stability": "stable",
      "summary": "Deactivate a product in the catalog.",
      "risk_level": "high"
    },
    {
      "id": "module:admin_update_product",
      "title": "Admin Update Product",
      "kind": "module",
      "path": "modules/admin_update_product.json",
      "tags": [
        "admin",
        "neoeats",
        "saga"
      ],
      "stability": "stable",
      "summary": "Update product metadata or lot quantities.",
      "risk_level": "high"
    },
    {
      "id": "module:alert_block",
      "title": "Alert Block",
      "kind": "module",
      "path": "modules/alert_block.json",
      "tags": [
        "alerts",
        "neoeats",
        "saga"
      ],
      "stability": "stable",
      "summary": "Create staff alerts for expiring inventory.",
      "risk_level": "medium"
    },
    {
      "id": "module:approval_block",
      "title": "Approval Block",
      "kind": "module",
      "path": "modules/approval_block.json",
      "tags": [
        "approval",
        "hot_offer",
        "neoeats",
        "saga"
      ],
      "stability": "stable",
      "summary": "Approve or reject a hot offer and persist final status.",
      "risk_level": "high"
    },
    {
      "id": "module:billing_block",
      "title": "Billing Block",
      "kind": "module",
      "path": "modules/billing_block.json",
      "tags": [
        "finance",
        "neoeats",
        "saga"
      ],
      "stability": "stable",
      "summary": "Compute billing totals and generate receipt metadata.",
      "risk_level": "medium"
    },
    {
      "id": "module:culinary_validator",
      "title": "Culinary Validator",
      "kind": "module",
      "path": "modules/culinary_validator.json",
      "tags": [
        "hot_offer",
        "neoeats",
        "quality",
        "saga"
      ],
      "stability": "stable",
      "summary": "Validate hot offer palatability and safety using LLM scoring.",
      "risk_level": "medium"
    },
    {
      "id": "module:daily_expiry_scan",
      "title": "Daily Expiry Scan",
      "kind": "module",
      "path": "modules/daily_expiry_scan.json",
      "tags": [
        "inventory",
        "neoeats",
        "saga"
      ],
      "stability": "stable",
      "summary": "Scan inventory lots for expiring items.",
      "risk_level": "low"
    },
    {
      "id": "module:hot_offer_generator",
      "title": "Hot Offer Generator",
      "kind": "module",
      "path": "modules/hot_offer_generator.json",
      "tags": [
        "hot_offer",
        "neoeats",
        "saga"
      ],
      "stability": "stable",
      "summary": "Generate a hot offer from priority inventory and sales stats.",
      "risk_level": "medium"
    },
    {
      "id": "module:inventory_block",
      "title": "Inventory Block",
      "kind": "module",
      "path": "modules/inventory_block.json",
      "tags": [
        "inventory",
        "neoeats",
        "saga"
      ],
      "stability": "stable",
      "summary": "Reserve, release, or commit inventory in the ledger.",
      "risk_level": "high"
    },
    {
      "id": "module:inventory_sync",
      "title": "Inventory Sync",
      "kind": "module",
      "path": "modules/inventory_sync.json",
      "tags": [
        "inventory",
        "neoeats",
        "saga",
        "sync"
      ],
      "stability": "experimental",
      "summary": "Sync inventory updates and check ingredient availability against stock_levels.",
      "risk_level": "high"
    },
    {
      "id": "module:job_scorer",
      "title": "Job Scorer",
      "kind": "module",
      "path": "modules/job_scorer.json",
      "tags": [
        "jobs",
        "ranking",
        "saga"
      ],
      "stability": "stable",
      "summary": "Score a list of jobs for a user persona and optionally persist the scores.",
      "risk_level": "low"
    },
    {
      "id": "module:market_scanner",
      "title": "Market Scanner",
      "kind": "module",
      "path": "modules/market_scanner.json",
      "tags": [
        "discovery",
        "jobs",
        "saga"
      ],
      "stability": "stable",